{
  "format": "jobhound-company",
  "schema_version": 1,
  "id": "labcorp-holdings",
  "name": "Labcorp Holdings",
  "aliases": [],
  "website_url": "https://www.labcorp.com/",
  "logo_url": "https://www.google.com/s2/favicons?domain=labcorp.com&sz=128",
  "facets": {
    "industries": [],
    "specialties": [],
    "tags": [
      "Fortune 350",
      "2026",
      "United States"
    ]
  }
}
