{
  "format": "jobhound-company",
  "schema_version": 1,
  "id": "wilson-sonsini",
  "name": "Wilson Sonsini",
  "legal_name": null,
  "aliases": [],
  "website_url": "https://www.wsgr.com",
  "logo_url": null,
  "facets": {
    "industries": [
      "legal-services"
    ],
    "specialties": [
      "law-firm"
    ],
    "tags": [
      "Big Law",
      "Legal Services"
    ]
  }
}
