{
  "format": "jobhound-company",
  "schema_version": 1,
  "id": "franklin-resources",
  "name": "Franklin Resources",
  "aliases": [],
  "website_url": "https://www.franklintempleton.com/",
  "logo_url": "https://www.google.com/s2/favicons?domain=franklintempleton.com&sz=128",
  "facets": {
    "industries": [],
    "specialties": [],
    "tags": [
      "Fortune 500",
      "2026",
      "United States"
    ]
  },
  "availability": {
    "status": "unavailable",
    "reason": "repair-needed",
    "message": "The indexed Franklin Templeton Workday board returned zero jobs in a fresh runtime check; the branded careers listing needs a current validated recipe.",
    "checked_at": "2026-09-30T16:54:07.465060+00:00"
  }
}
