{
  "format": "jobhound-company",
  "schema_version": 1,
  "id": "hearts-science-canada",
  "name": "Hearts & Science Canada",
  "legal_name": null,
  "aliases": [],
  "website_url": "https://hearts-science.com/fr-ca/",
  "logo_url": "https://hearts-science.com/apple-touch-icon.png",
  "facets": {
    "industries": [
      "marketing"
    ],
    "specialties": [
      "performance-marketing",
      "martech-data-analytics",
      "market-research-insights"
    ],
    "tags": [
      "Marketing",
      "Canada",
      "Omnicom"
    ]
  },
  "parent_company_id": "omnicom",
  "availability": {
    "status": "unavailable",
    "reason": "repair-needed",
    "message": "The Marketing Job Board collector has not yet been converted and validated as a JobHound monitor.",
    "checked_at": "2026-09-30T00:53:28.032653Z"
  }
}
