{
  "format": "jobhound-company",
  "schema_version": 1,
  "id": "penske-automotive",
  "name": "Penske Automotive Group",
  "aliases": [],
  "website_url": "https://www.penskeautomotive.com/",
  "logo_url": "https://www.google.com/s2/favicons?domain=penskeautomotive.com&sz=128",
  "facets": {
    "industries": [],
    "specialties": [],
    "tags": [
      "Fortune 150",
      "2026",
      "United States"
    ]
  }
}
