{
  "format": "jobhound-company",
  "schema_version": 1,
  "id": "lg2",
  "name": "LG2",
  "legal_name": null,
  "aliases": [],
  "website_url": "https://lg2.com/",
  "logo_url": "https://lg2.com/favicon.ico",
  "facets": {
    "industries": [
      "marketing"
    ],
    "specialties": [
      "creative-advertising",
      "performance-marketing",
      "web-ux-digital-experience",
      "social-content-influencer",
      "experiential"
    ],
    "tags": [
      "Marketing",
      "Canada"
    ]
  },
  "availability": {
    "status": "unavailable",
    "reason": "repair-needed",
    "message": "The Marketing Job Board collector has not yet been converted and validated as a JobHound monitor.",
    "checked_at": "2026-09-30T00:53:28.032653Z"
  }
}
