{
  "format": "jobhound-company",
  "schema_version": 1,
  "id": "havas",
  "name": "Havas",
  "legal_name": null,
  "aliases": [],
  "website_url": "https://www.havas.com/",
  "logo_url": null,
  "facets": {
    "industries": [
      "marketing"
    ],
    "specialties": [],
    "tags": [
      "Marketing group"
    ]
  }
}
