{
  "format": "jobhound-company",
  "schema_version": 1,
  "id": "vertiv-holdings",
  "name": "Vertiv Holdings",
  "aliases": [],
  "website_url": "https://www.vertiv.com/",
  "logo_url": "https://www.google.com/s2/favicons?domain=vertiv.com&sz=128",
  "facets": {
    "industries": [],
    "specialties": [],
    "tags": [
      "Fortune 500",
      "2026",
      "United States"
    ]
  }
}
