{
  "format": "jobhound-company",
  "schema_version": 1,
  "id": "commercial-metals",
  "name": "Commercial Metals",
  "aliases": [],
  "website_url": "https://www.cmc.com/",
  "logo_url": "https://www.google.com/s2/favicons?domain=cmc.com&sz=128",
  "facets": {
    "industries": [],
    "specialties": [],
    "tags": [
      "Fortune 500",
      "2026",
      "United States"
    ]
  }
}
