{
  "format": "jobhound-company",
  "schema_version": 1,
  "id": "southern",
  "name": "Southern Company",
  "aliases": [],
  "website_url": "https://www.southerncompany.com/",
  "logo_url": "https://www.google.com/s2/favicons?domain=southerncompany.com&sz=128",
  "facets": {
    "industries": [],
    "specialties": [],
    "tags": [
      "Fortune 200",
      "2026",
      "United States"
    ]
  }
}
